{
  "artifacts": [
    {
      "mime_type": "application/json",
      "path": "proposal.json",
      "revision": "3f2f42a4682b9bf10b34bfa7505598f6f40bda9a868c19c59f32d145cbc9ba7a",
      "sha256": "44e208b285e73b895705a39214b03efd9fe133d4a3bc12cc89c5f0213fc002d5",
      "size_bytes": 15044
    },
    {
      "mime_type": "application/json",
      "path": "registry_snapshot.json",
      "revision": "3f2f42a4682b9bf10b34bfa7505598f6f40bda9a868c19c59f32d145cbc9ba7a",
      "sha256": "9cd5a08b210f3259b4d4ae226dc4a6b5991c3f707aa2d3ba12fb79b897a7f245",
      "size_bytes": 37
    },
    {
      "mime_type": "application/x-python-code",
      "path": "simulation/__pycache__/codeaster_contact_worker.cpython-311.pyc",
      "revision": "3f2f42a4682b9bf10b34bfa7505598f6f40bda9a868c19c59f32d145cbc9ba7a",
      "sha256": "93ff2d9def5edfee55592a25408391cffcdb170f4519304d04380de4e5cc6a3e",
      "size_bytes": 60191
    },
    {
      "mime_type": "application/x-python-code",
      "path": "simulation/__pycache__/codeaster_worker.cpython-311.pyc",
      "revision": "3f2f42a4682b9bf10b34bfa7505598f6f40bda9a868c19c59f32d145cbc9ba7a",
      "sha256": "f5edb113c64a71099232078d473d23b238a38949b36b19b1bc16c140ccef74d1",
      "size_bytes": 62465
    },
    {
      "mime_type": "application/json",
      "path": "simulation/analysis_raw.json",
      "revision": "3f2f42a4682b9bf10b34bfa7505598f6f40bda9a868c19c59f32d145cbc9ba7a",
      "sha256": "a26cfa05c8de14fc232b05057ff3489a97193a951ee618a5047d35dfad6c4499",
      "size_bytes": 585540
    },
    {
      "mime_type": "application/json",
      "path": "simulation/analytical_reference.json",
      "revision": "3f2f42a4682b9bf10b34bfa7505598f6f40bda9a868c19c59f32d145cbc9ba7a",
      "sha256": "1b27f9f3ad9bf3aa1016b2ca5e9cd5a6a033a4e222e7221b24d260b8f08f9b34",
      "size_bytes": 1462
    },
    {
      "mime_type": "text/x-python",
      "path": "simulation/codeaster_contact.py",
      "revision": "3f2f42a4682b9bf10b34bfa7505598f6f40bda9a868c19c59f32d145cbc9ba7a",
      "sha256": "6f2ea3c3fed8ff69af4665e526ab08bead026e19813b14968ddca67e84da1911",
      "size_bytes": 15347
    },
    {
      "mime_type": "text/x-python",
      "path": "simulation/codeaster_contact_worker.py",
      "revision": "3f2f42a4682b9bf10b34bfa7505598f6f40bda9a868c19c59f32d145cbc9ba7a",
      "sha256": "f12da3e35fd3ff4dde049f9343734e4909d3b16ff63327f44368a38b86d1559e",
      "size_bytes": 34449
    },
    {
      "mime_type": "text/x-python",
      "path": "simulation/codeaster_execution.py",
      "revision": "3f2f42a4682b9bf10b34bfa7505598f6f40bda9a868c19c59f32d145cbc9ba7a",
      "sha256": "04bf82ca3ea258a9218f9de33c14aefda1319abfa199fa246c36d5d1cefc2fad",
      "size_bytes": 1347
    },
    {
      "mime_type": "text/x-python",
      "path": "simulation/codeaster_runtime_adapter.py",
      "revision": "3f2f42a4682b9bf10b34bfa7505598f6f40bda9a868c19c59f32d145cbc9ba7a",
      "sha256": "956e84044d0b35780a23648577771236b708fefeb8d69492b6d85cdf4a25165a",
      "size_bytes": 41300
    },
    {
      "mime_type": "text/x-python",
      "path": "simulation/codeaster_worker.py",
      "revision": "3f2f42a4682b9bf10b34bfa7505598f6f40bda9a868c19c59f32d145cbc9ba7a",
      "sha256": "856219f47b0410c68d3163d8e1206f3cf1627d421accfefb14eada5b57b627dc",
      "size_bytes": 33550
    },
    {
      "mime_type": "text/x-python",
      "path": "simulation/domain_reference.py",
      "revision": "3f2f42a4682b9bf10b34bfa7505598f6f40bda9a868c19c59f32d145cbc9ba7a",
      "sha256": "7709705c2e7f948a768a90f9efa7f3d203d1fecebc7fe42f89b64b5b7f6cb819",
      "size_bytes": 17914
    },
    {
      "mime_type": "text/x-python",
      "path": "simulation/execution_control.py",
      "revision": "3f2f42a4682b9bf10b34bfa7505598f6f40bda9a868c19c59f32d145cbc9ba7a",
      "sha256": "e4fca5ca504f71b15503cb3dc83b30e78787f56957e138086c0d1a46af84aede",
      "size_bytes": 6546
    },
    {
      "mime_type": "application/json",
      "path": "simulation/frozen_mesh.json",
      "revision": "3f2f42a4682b9bf10b34bfa7505598f6f40bda9a868c19c59f32d145cbc9ba7a",
      "sha256": "7398ce4349f076e225e76d1d840d60da1dfe24b57181c1ae1d7b5cfc069d8291",
      "size_bytes": 84849
    },
    {
      "mime_type": "application/json",
      "path": "simulation/input.json",
      "revision": "3f2f42a4682b9bf10b34bfa7505598f6f40bda9a868c19c59f32d145cbc9ba7a",
      "sha256": "0c2e3d120a5b893cb15568095b921d24dcb2bfe10c4d5630f08102b9b534c0a4",
      "size_bytes": 243
    },
    {
      "mime_type": "application/octet-stream",
      "path": "simulation/level_0/aster.mess",
      "revision": "3f2f42a4682b9bf10b34bfa7505598f6f40bda9a868c19c59f32d145cbc9ba7a",
      "sha256": "32b5fa09a013e1a1bdf266e0c5f404df29196a430e15f49b72d2e17dacb3f4a2",
      "size_bytes": 42724
    },
    {
      "mime_type": "application/octet-stream",
      "path": "simulation/level_0/aster.resu",
      "revision": "3f2f42a4682b9bf10b34bfa7505598f6f40bda9a868c19c59f32d145cbc9ba7a",
      "sha256": "827fc082c6d119be6be320bd571f46e97c415164cf80be4f201c8dc65023af50",
      "size_bytes": 165533
    },
    {
      "mime_type": "application/json",
      "path": "simulation/level_0/domain_contact_observation.json",
      "revision": "3f2f42a4682b9bf10b34bfa7505598f6f40bda9a868c19c59f32d145cbc9ba7a",
      "sha256": "d952dcf8087d5e20f67e6e9ce098d39602e8e4ae3f70193d93e1e7746a55ccf1",
      "size_bytes": 470585
    },
    {
      "mime_type": "application/json",
      "path": "simulation/level_0/input.json",
      "revision": "3f2f42a4682b9bf10b34bfa7505598f6f40bda9a868c19c59f32d145cbc9ba7a",
      "sha256": "22e4af5cc3a74b30bd084599b50a65539559552ddda56a259e73d3cdf0994164",
      "size_bytes": 464
    },
    {
      "mime_type": "application/octet-stream",
      "path": "simulation/level_0/mesh.mmed",
      "revision": "3f2f42a4682b9bf10b34bfa7505598f6f40bda9a868c19c59f32d145cbc9ba7a",
      "sha256": "825e79a01b983b14b136d4fc2490c2bc40e85ccc25ebd8ae6aa32e88dd544f91",
      "size_bytes": 63046
    },
    {
      "mime_type": "application/json",
      "path": "simulation/level_0/mesh_catalog.json",
      "revision": "3f2f42a4682b9bf10b34bfa7505598f6f40bda9a868c19c59f32d145cbc9ba7a",
      "sha256": "aa3adb9aaaa8b09adb0f277f2dac9a114bd41bfcf9574f7907f9237720537488",
      "size_bytes": 77751
    },
    {
      "mime_type": "application/octet-stream",
      "path": "simulation/level_0/model.comm",
      "revision": "3f2f42a4682b9bf10b34bfa7505598f6f40bda9a868c19c59f32d145cbc9ba7a",
      "sha256": "b39058e35b4ceb7e112ba318d51f05afd8a3fcf7753d2a46b6377a002057a7bb",
      "size_bytes": 128
    },
    {
      "mime_type": "application/octet-stream",
      "path": "simulation/level_0/model.export",
      "revision": "3f2f42a4682b9bf10b34bfa7505598f6f40bda9a868c19c59f32d145cbc9ba7a",
      "sha256": "75ea385d125b190555a711fd233a8901593e5e6eefc36f30c0b3fc6bb735fd5b",
      "size_bytes": 266
    },
    {
      "mime_type": "application/json",
      "path": "simulation/level_0/native_access_parameters.json",
      "revision": "3f2f42a4682b9bf10b34bfa7505598f6f40bda9a868c19c59f32d145cbc9ba7a",
      "sha256": "5a13b9db97ef5413956d6b863eb36b28636de7654cf0744391990a548e8c015e",
      "size_bytes": 160
    },
    {
      "mime_type": "application/json",
      "path": "simulation/level_0/native_material.json",
      "revision": "3f2f42a4682b9bf10b34bfa7505598f6f40bda9a868c19c59f32d145cbc9ba7a",
      "sha256": "b50d0f0c32868e2804d9d73519b6849409e6e9ee3376b4874fd8521645147020",
      "size_bytes": 138
    },
    {
      "mime_type": "application/json",
      "path": "simulation/level_0/native_mesh_checks.json",
      "revision": "3f2f42a4682b9bf10b34bfa7505598f6f40bda9a868c19c59f32d145cbc9ba7a",
      "sha256": "600747658d78f0c339990cfa7f3f5c35f8d46fe0e756f4f5a9fdd1fe4cdadfaf",
      "size_bytes": 37618
    },
    {
      "mime_type": "application/json",
      "path": "simulation/level_0/native_policy.json",
      "revision": "3f2f42a4682b9bf10b34bfa7505598f6f40bda9a868c19c59f32d145cbc9ba7a",
      "sha256": "721321d1d7ea1e228420eb62ca5495fc97c550a6ce2a958d3deb641de61de03b",
      "size_bytes": 1240
    },
    {
      "mime_type": "application/json",
      "path": "simulation/level_0/nonlinear_convergence.json",
      "revision": "3f2f42a4682b9bf10b34bfa7505598f6f40bda9a868c19c59f32d145cbc9ba7a",
      "sha256": "e0dc903c78b70a22bd2d3a84a36f3fe4eb307c92ff0ab22f0d210854fb2577c8",
      "size_bytes": 1361
    },
    {
      "mime_type": "application/json",
      "path": "simulation/level_0/order_1_depl.table.json",
      "revision": "3f2f42a4682b9bf10b34bfa7505598f6f40bda9a868c19c59f32d145cbc9ba7a",
      "sha256": "4c5151a76d2c6213ac50b2d80d15a8ab8b56daf716352f64d0c28bcf24043bb1",
      "size_bytes": 47028
    },
    {
      "mime_type": "application/json",
      "path": "simulation/level_0/order_1_lags_c.table.json",
      "revision": "3f2f42a4682b9bf10b34bfa7505598f6f40bda9a868c19c59f32d145cbc9ba7a",
      "sha256": "dab8e1aa25b113ac555077b2a56fe460239f2a722355e7dc5cbcd2e41fc0d78e",
      "size_bytes": 1543
    },
    {
      "mime_type": "application/json",
      "path": "simulation/level_0/order_1_reac_noda.table.json",
      "revision": "3f2f42a4682b9bf10b34bfa7505598f6f40bda9a868c19c59f32d145cbc9ba7a",
      "sha256": "7fb7feacf1120a34d58fbaa63d49ec75e9e3255fb71912e7855765be54b3d8ab",
      "size_bytes": 48906
    },
    {
      "mime_type": "application/json",
      "path": "simulation/level_0/order_1_sief_elga.table.json",
      "revision": "3f2f42a4682b9bf10b34bfa7505598f6f40bda9a868c19c59f32d145cbc9ba7a",
      "sha256": "4128e22c03ef6bc5d634d206286c346baf2756685d29ec2e63524d73bb23ed12",
      "size_bytes": 234850
    },
    {
      "mime_type": "application/json",
      "path": "simulation/level_0/parsed_contact.json",
      "revision": "3f2f42a4682b9bf10b34bfa7505598f6f40bda9a868c19c59f32d145cbc9ba7a",
      "sha256": "04a8ec6963ae0810ed1272b8038fb113426ef8d01a6cf286a83724800cf7216d",
      "size_bytes": 471548